Name,YouTube_ID__c,Level__c,Category__c,Price__c,Duration_Minutes__c,Is_Free_Preview__c,Description__c
Old-School R&B Guitar: At Last (Etta James),JgGuQwQ5kgo,Intermediate,Song Lesson,10.99,16,false,Learn to play this classic Etta James standard with soul-drenched R&B chord voicings and smooth melodic phrasing.
Soloing on Long Train Runnin',zgv31Oo1N-I,Intermediate,Song Lesson,11.99,18,false,Craft expressive bluesy solos over this Doobie Brothers classic using pentatonic vocabulary and soulful phrasing.
Modern Soulful R&B Rhythm Guitar,Iki1s2i6FPQ,Intermediate,Technique,11.99,14,false,Master the layered chord techniques and rhythmic patterns that define modern R&B and soul guitar playing.
Learn These Essential Soul Guitar Moves,Fs7eZse3mlE,Intermediate,Technique,10.99,13,false,Old-school soul guitar vocabulary: sweet chord embellishments and double stops you can use on any major chord.
Blues Meets Jazz: Robben Ford Chord Tricks,0hNeEXIdCO4,Advanced,Technique,13.99,20,false,Bridge the gap between blues and jazz with Robben Ford signature chord substitutions and sophisticated voicings.
Play Blues Like Robben Ford!,FHhlq3JbL08,Advanced,Song Lesson,14.99,22,false,Two choruses of jazz-blues improvisation in the Robben Ford style with sophisticated phrasing over classic changes.
